{
  "$schema": "https://json-schema.org/draft/2020-12/schema",
  "$id": "https://schemas.noveraprotocol.org/v0.1/workflow-profile.schema.json",
  "title": "Novera workflow profile",
  "description": "Versioned, machine-readable authorization profile for a NovaDeed workflow. A profile defines who may propose a transition, which confirmations are required, and which policies or evidence categories gate the transition. Profiles are configuration records, not legal rules or regulatory determinations.",
  "type": "object",
  "additionalProperties": false,
  "required": ["specVersion", "recordType", "workflowProfileId", "profileVersion", "workflowType", "transitionRules", "metadata"],
  "properties": {
    "specVersion": { "description": "Specification version.", "$ref": "common.schema.json#/$defs/specVersion" },
    "recordType": { "description": "Record type discriminator.", "const": "workflow_profile" },
    "workflowProfileId": {
      "description": "Stable namespaced identifier for this workflow profile family.",
      "type": "string",
      "pattern": "^[a-z][a-z0-9-]{1,31}:[a-z][a-z0-9_.]{0,95}$"
    },
    "profileVersion": {
      "description": "Semantic version of this exact profile definition.",
      "type": "string",
      "pattern": "^[0-9]+\\.[0-9]+\\.[0-9]+([-+][0-9A-Za-z.-]+)?$"
    },
    "workflowType": {
      "description": "Workflow type to which this profile applies.",
      "type": "string",
      "pattern": "^([a-z][a-z0-9-]{1,31}:)?[a-z][a-z0-9_]{0,63}$"
    },
    "transitionRules": {
      "description": "Machine-readable authorization rules for transitions governed by this profile.",
      "type": "array",
      "minItems": 1,
      "items": { "$ref": "#/$defs/transitionRule" }
    },
    "metadata": { "description": "Namespaced, non-normative metadata.", "$ref": "common.schema.json#/$defs/metadata" }
  },
  "$defs": {
    "state": {
      "description": "Workflow state used by a profile rule.",
      "anyOf": [
        { "enum": ["draft", "proposed", "under_review", "conditions_pending", "approved", "ready_for_settlement", "settlement_pending", "completed", "cancelled"] },
        { "$ref": "common.schema.json#/$defs/extensionToken" }
      ]
    },
    "role": {
      "description": "Workflow role permitted or required by an authorization rule.",
      "type": "string",
      "pattern": "^([a-z][a-z0-9-]{1,31}:)?[a-z][a-z0-9_]{0,63}$"
    },
    "proposerRule": {
      "description": "Actors allowed to propose a transition.",
      "type": "object",
      "additionalProperties": false,
      "required": ["actorTypes"],
      "properties": {
        "actorTypes": {
          "description": "Actor types that may propose the transition.",
          "type": "array",
          "minItems": 1,
          "uniqueItems": true,
          "items": { "$ref": "common.schema.json#/$defs/actorType" }
        },
        "roles": {
          "description": "Permitted workflow roles when the proposer has a role. Empty or absent means the profile does not further restrict role for an allowed actor type.",
          "type": "array",
          "uniqueItems": true,
          "items": { "$ref": "#/$defs/role" }
        }
      }
    },
    "requiredActor": {
      "description": "One actor class and role whose confirmation is required.",
      "type": "object",
      "additionalProperties": false,
      "required": ["actorType", "count"],
      "properties": {
        "actorType": { "description": "Required confirmer actor type.", "$ref": "common.schema.json#/$defs/actorType" },
        "role": { "description": "Required confirmer role, when role-based authorization applies.", "$ref": "#/$defs/role" },
        "count": { "description": "Minimum number of distinct confirmations satisfying this requirement.", "type": "integer", "minimum": 1 }
      }
    },
    "confirmationRule": {
      "description": "Confirmation threshold and separation-of-duties requirements for one transition.",
      "type": "object",
      "additionalProperties": false,
      "required": ["minCount", "requiredActors", "disallowProposerConfirmation"],
      "properties": {
        "minCount": { "description": "Minimum total number of distinct confirmation events required.", "type": "integer", "minimum": 0 },
        "requiredActors": {
          "description": "Actor-type and role-specific confirmation requirements.",
          "type": "array",
          "items": { "$ref": "#/$defs/requiredActor" }
        },
        "disallowProposerConfirmation": {
          "description": "When true, the actor that proposed the transition cannot satisfy a confirmation requirement.",
          "type": "boolean"
        }
      }
    },
    "transitionRule": {
      "description": "Authorization and gating rule for one workflow-state transition.",
      "type": "object",
      "additionalProperties": false,
      "required": ["from", "to", "proposer", "confirmation", "requiredPolicyIds", "requiredEvidenceTypes"],
      "properties": {
        "from": {
          "description": "Source state, or null for creation.",
          "oneOf": [{ "type": "null" }, { "$ref": "#/$defs/state" }]
        },
        "to": { "description": "Target state.", "$ref": "#/$defs/state" },
        "proposer": { "description": "Who may propose this transition.", "$ref": "#/$defs/proposerRule" },
        "confirmation": { "description": "Confirmations required before the transition can be applied.", "$ref": "#/$defs/confirmationRule" },
        "requiredPolicyIds": {
          "description": "Policies that MUST have a current permitting result before this transition may be applied.",
          "type": "array",
          "uniqueItems": true,
          "items": { "type": "string", "pattern": "^[a-z][a-z0-9-]{1,31}:[a-z][a-z0-9_.]{0,95}$" }
        },
        "requiredEvidenceTypes": {
          "description": "Evidence categories the workflow profile requires for this transition. v0.1 records this requirement but does not yet resolve every referenced evidence record in the validator.",
          "type": "array",
          "uniqueItems": true,
          "items": { "type": "string", "pattern": "^([a-z][a-z0-9-]{1,31}:)?[a-z][a-z0-9_]{0,63}$" }
        }
      }
    }
  }
}
